{
  "exploration_generation_id": "ROUTEEXP:1b3ed02aafed",
  "seed_hash": "1b3ed02aafed1146376cd52840a416ab847c7d43ff1f2cd904f8803da323add1",
  "gate_value": 0.06747767,
  "exploration_probability": 0.25,
  "baseline_total_score": 288.9096,
  "applied": false,
  "reason": "no_eligible_low_regret_swap",
  "pair_id": null,
  "workers": [],
  "baseline_slots": [],
  "exploration_slots": [],
  "match_level": null,
  "match_basis": null,
  "absolute_regret": 0.0,
  "relative_regret": 0.0,
  "measurement_need": 0,
  "candidate_count": 0,
  "routing_generation_id": "ROUTING:afc565565c09",
  "worker_profile_generation_id": "WORKERS:45cdbf855c3e",
  "routing_learning_generation_id": "ROUTELEARN:bc40639ef4db",
  "activation_response_learning_generation_id": "RESPLEARN:5166e450db73"
}
